[{"facultad": "Facultad de Arquitectura", "carrera": "Arquitectura", "ciclo": "10° Ciclo", "Totalmente satisfecho": 3, "Muy satisfecho": 5, "Satisfecho": 8, "Insatisfecho": 0, "Totalmente insatisfecho": 1, "No utilizo": 0, "No conozco": 0, "score": 94.12}, {"facultad": "Facultad de Arquitectura", "carrera": "Arquitectura", "ciclo": "2° Ciclo", "Totalmente satisfecho": 7, "Muy satisfecho": 7, "Satisfecho": 8, "Insatisfecho": 0, "Totalmente insatisfecho": 0, "No utilizo": 0, "No conozco": 0, "score": 100.0}, {"facultad": "Facultad de Arquitectura", "carrera": "Arquitectura", "ciclo": "3° Ciclo", "Totalmente satisfecho": 4, "Muy satisfecho": 7, "Satisfecho": 8, "Insatisfecho": 0, "Totalmente insatisfecho": 0, "No utilizo": 0, "No conozco": 0, "score": 100.0}, {"facultad": "Facultad de Arquitectura", "carrera": "Arquitectura", "ciclo": "4° Ciclo", "Totalmente satisfecho": 23, "Muy satisfecho": 16, "Satisfecho": 25, "Insatisfecho": 1, "Totalmente insatisfecho": 0, "No utilizo": 0, "No conozco": 0, "score": 98.46}, {"facultad": "Facultad de Arquitectura", "carrera": "Arquitectura", "ciclo": "5° Ciclo", "Totalmente satisfecho": 4, "Muy satisfecho": 9, "Satisfecho": 11, "Insatisfecho": 0, "Totalmente insatisfecho": 0, "No utilizo": 0, "No conozco": 0, "score": 100.0}, {"facultad": "Facultad de Arquitectura", "carrera": "Arquitectura", "ciclo": "6° Ciclo", "Totalmente satisfecho": 4, "Muy satisfecho": 6, "Satisfecho": 4, "Insatisfecho": 0, "Totalmente insatisfecho": 0, "No utilizo": 0, "No conozco": 0, "score": 100.0}, {"facultad": "Facultad de Arquitectura", "carrera": "Arquitectura", "ciclo": "7° Ciclo", "Totalmente satisfecho": 5, "Muy satisfecho": 3, "Satisfecho": 10, "Insatisfecho": 0, "Totalmente insatisfecho": 0, "No utilizo": 0, "No conozco": 0, "score": 100.0}, {"facultad": "Facultad de Arquitectura", "carrera": "Arquitectura", "ciclo": "8° Ciclo", "Totalmente satisfecho": 9, "Muy satisfecho": 6, "Satisfecho": 9, "Insatisfecho": 0, "Totalmente insatisfecho": 0, "No utilizo": 0, "No conozco": 0, "score": 100.0}, {"facultad": "Facultad de Arquitectura", "carrera": "Arquitectura", "ciclo": "9° Ciclo", "Totalmente satisfecho": 3, "Muy satisfecho": 2, "Satisfecho": 3, "Insatisfecho": 0, "Totalmente insatisfecho": 0, "No utilizo": 0, "No conozco": 0, "score": 100.0}, {"facultad": "Facultad de Ciencias Empresariales", "carrera": "Administración", "ciclo": "10° Ciclo", "Totalmente satisfecho": 6, "Muy satisfecho": 1, "Satisfecho": 1, "Insatisfecho": 0, "Totalmente insatisfecho": 0, "No utilizo": 0, "No conozco": 0, "score": 100.0}, {"facultad": "Facultad de Ciencias Empresariales", "carrera": "Administración", "ciclo": "1° Ciclo", "Totalmente satisfecho": 16, "Muy satisfecho": 10, "Satisfecho": 8, "Insatisfecho": 0, "Totalmente insatisfecho": 0, "No utilizo": 0, "No conozco": 0, "score": 100.0}, {"facultad": "Facultad de Ciencias Empresariales", "carrera": "Administración", "ciclo": "2° Ciclo", "Totalmente satisfecho": 21, "Muy satisfecho": 17, "Satisfecho": 15, "Insatisfecho": 0, "Totalmente insatisfecho": 0, "No utilizo": 0, "No conozco": 0, "score": 100.0}, {"facultad": "Facultad de Ciencias Empresariales", "carrera": "Administración", "ciclo": "3° Ciclo", "Totalmente satisfecho": 16, "Muy satisfecho": 14, "Satisfecho": 9, "Insatisfecho": 0, "Totalmente insatisfecho": 0, "No utilizo": 0, "No conozco": 0, "score": 100.0}, {"facultad": "Facultad de Ciencias Empresariales", "carrera": "Administración", "ciclo": "4° Ciclo", "Totalmente satisfecho": 34, "Muy satisfecho": 21, "Satisfecho": 16, "Insatisfecho": 1, "Totalmente insatisfecho": 0, "No utilizo": 0, "No conozco": 0, "score": 98.61}, {"facultad": "Facultad de Ciencias Empresariales", "carrera": "Administración", "ciclo": "5° Ciclo", "Totalmente satisfecho": 36, "Muy satisfecho": 20, "Satisfecho": 20, "Insatisfecho": 2, "Totalmente insatisfecho": 2, "No utilizo": 0, "No conozco": 0, "score": 95.0}, {"facultad": "Facultad de Ciencias Empresariales", "carrera": "Administración", "ciclo": "6° Ciclo", "Totalmente satisfecho": 27, "Muy satisfecho": 18, "Satisfecho": 23, "Insatisfecho": 1, "Totalmente insatisfecho": 0, "No utilizo": 0, "No conozco": 0, "score": 98.55}, {"facultad": "Facultad de Ciencias Empresariales", "carrera": "Administración", "ciclo": "7° Ciclo", "Totalmente satisfecho": 23, "Muy satisfecho": 17, "Satisfecho": 17, "Insatisfecho": 2, "Totalmente insatisfecho": 0, "No utilizo": 0, "No conozco": 0, "score": 96.61}, {"facultad": "Facultad de Ciencias Empresariales", "carrera": "Administración", "ciclo": "8° Ciclo", "Totalmente satisfecho": 37, "Muy satisfecho": 7, "Satisfecho": 17, "Insatisfecho": 1, "Totalmente insatisfecho": 0, "No utilizo": 0, "No conozco": 0, "score": 98.39}, {"facultad": "Facultad de Ciencias Empresariales", "carrera": "Administración", "ciclo": "9° Ciclo", "Totalmente satisfecho": 9, "Muy satisfecho": 7, "Satisfecho": 4, "Insatisfecho": 1, "Totalmente insatisfecho": 0, "No utilizo": 0, "No conozco": 0, "score": 95.24}, {"facultad": "Facultad de Ciencias Empresariales", "carrera": "Contabilidad y Finanzas", "ciclo": "10° Ciclo", "Totalmente satisfecho": 2, "Muy satisfecho": 0, "Satisfecho": 0, "Insatisfecho": 0, "Totalmente insatisfecho": 0, "No utilizo": 0, "No conozco": 0, "score": 100.0}, {"facultad": "Facultad de Ciencias Empresariales", "carrera": "Contabilidad y Finanzas", "ciclo": "1° Ciclo", "Totalmente satisfecho": 1, "Muy satisfecho": 0, "Satisfecho": 0, "Insatisfecho": 0, "Totalmente insatisfecho": 0, "No utilizo": 0, "No conozco": 0, "score": 100.0}, {"facultad": "Facultad de Ciencias Empresariales", "carrera": "Contabilidad y Finanzas", "ciclo": "2° Ciclo", "Totalmente satisfecho": 0, "Muy satisfecho": 4, "Satisfecho": 3, "Insatisfecho": 0, "Totalmente insatisfecho": 0, "No utilizo": 0, "No conozco": 0, "score": 100.0}, {"facultad": "Facultad de Ciencias Empresariales", "carrera": "Contabilidad y Finanzas", "ciclo": "3° Ciclo", "Totalmente satisfecho": 4, "Muy satisfecho": 1, "Satisfecho": 0, "Insatisfecho": 0, "Totalmente insatisfecho": 0, "No utilizo": 0, "No conozco": 0, "score": 100.0}, {"facultad": "Facultad de Ciencias Empresariales", "carrera": "Contabilidad y Finanzas", "ciclo": "4° Ciclo", "Totalmente satisfecho": 5, "Muy satisfecho": 4, "Satisfecho": 1, "Insatisfecho": 0, "Totalmente insatisfecho": 0, "No utilizo": 0, "No conozco": 0, "score": 100.0}, {"facultad": "Facultad de Ciencias Empresariales", "carrera": "Contabilidad y Finanzas", "ciclo": "5° Ciclo", "Totalmente satisfecho": 6, "Muy satisfecho": 0, "Satisfecho": 2, "Insatisfecho": 2, "Totalmente insatisfecho": 0, "No utilizo": 0, "No conozco": 0, "score": 80.0}, {"facultad": "Facultad de Ciencias Empresariales", "carrera": "Contabilidad y Finanzas", "ciclo": "6° Ciclo", "Totalmente satisfecho": 5, "Muy satisfecho": 5, "Satisfecho": 5, "Insatisfecho": 1, "Totalmente insatisfecho": 0, "No utilizo": 0, "No conozco": 0, "score": 93.75}, {"facultad": "Facultad de Ciencias Empresariales", "carrera": "Contabilidad y Finanzas", "ciclo": "7° Ciclo", "Totalmente satisfecho": 5, "Muy satisfecho": 3, "Satisfecho": 0, "Insatisfecho": 0, "Totalmente insatisfecho": 0, "No utilizo": 0, "No conozco": 0, "score": 100.0}, {"facultad": "Facultad de Ciencias Empresariales", "carrera": "Contabilidad y Finanzas", "ciclo": "8° Ciclo", "Totalmente satisfecho": 8, "Muy satisfecho": 10, "Satisfecho": 4, "Insatisfecho": 0, "Totalmente insatisfecho": 0, "No utilizo": 0, "No conozco": 0, "score": 100.0}, {"facultad": "Facultad de Ciencias Empresariales", "carrera": "Contabilidad y Finanzas", "ciclo": "9° Ciclo", "Totalmente satisfecho": 0, "Muy satisfecho": 2, "Satisfecho": 1, "Insatisfecho": 0, "Totalmente insatisfecho": 0, "No utilizo": 0, "No conozco": 0, "score": 100.0}, {"facultad": "Facultad de Ciencias Empresariales", "carrera": "Marketing", "ciclo": "10° Ciclo", "Totalmente satisfecho": 5, "Muy satisfecho": 1, "Satisfecho": 4, "Insatisfecho": 0, "Totalmente insatisfecho": 0, "No utilizo": 0, "No conozco": 0, "score": 100.0}, {"facultad": "Facultad de Ciencias Empresariales", "carrera": "Marketing", "ciclo": "1° Ciclo", "Totalmente satisfecho": 4, "Muy satisfecho": 4, "Satisfecho": 2, "Insatisfecho": 0, "Totalmente insatisfecho": 0, "No utilizo": 0, "No conozco": 0, "score": 100.0}, {"facultad": "Facultad de Ciencias Empresariales", "carrera": "Marketing", "ciclo": "2° Ciclo", "Totalmente satisfecho": 4, "Muy satisfecho": 1, "Satisfecho": 5, "Insatisfecho": 1, "Totalmente insatisfecho": 1, "No utilizo": 0, "No conozco": 0, "score": 83.33}, {"facultad": "Facultad de Ciencias Empresariales", "carrera": "Marketing", "ciclo": "3° Ciclo", "Totalmente satisfecho": 2, "Muy satisfecho": 6, "Satisfecho": 5, "Insatisfecho": 1, "Totalmente insatisfecho": 0, "No utilizo": 0, "No conozco": 0, "score": 92.86}, {"facultad": "Facultad de Ciencias Empresariales", "carrera": "Marketing", "ciclo": "4° Ciclo", "Totalmente satisfecho": 16, "Muy satisfecho": 15, "Satisfecho": 15, "Insatisfecho": 1, "Totalmente insatisfecho": 1, "No utilizo": 0, "No conozco": 0, "score": 95.83}, {"facultad": "Facultad de Ciencias Empresariales", "carrera": "Marketing", "ciclo": "5° Ciclo", "Totalmente satisfecho": 10, "Muy satisfecho": 7, "Satisfecho": 8, "Insatisfecho": 3, "Totalmente insatisfecho": 0, "No utilizo": 0, "No conozco": 0, "score": 89.29}, {"facultad": "Facultad de Ciencias Empresariales", "carrera": "Marketing", "ciclo": "6° Ciclo", "Totalmente satisfecho": 7, "Muy satisfecho": 7, "Satisfecho": 12, "Insatisfecho": 0, "Totalmente insatisfecho": 0, "No utilizo": 0, "No conozco": 0, "score": 100.0}, {"facultad": "Facultad de Ciencias Empresariales", "carrera": "Marketing", "ciclo": "7° Ciclo", "Totalmente satisfecho": 11, "Muy satisfecho": 4, "Satisfecho": 9, "Insatisfecho": 2, "Totalmente insatisfecho": 0, "No utilizo": 0, "No conozco": 0, "score": 92.31}, {"facultad": "Facultad de Ciencias Empresariales", "carrera": "Marketing", "ciclo": "8° Ciclo", "Totalmente satisfecho": 15, "Muy satisfecho":